{
  "schemaVersion": 2,
  "manifest": "migration/sources.json",
  "manifestSha256": "35d5e53ca38105779af4758bc8ee22ab90ae487f8e64c294bd8eb825634c92a9",
  "executionLock": {
    "path": "migration/execution-lock.json",
    "sha256": "c91e729ab343ffc652216dbcf9e4b8b3d650a6f1fecb8562dad7f419ba967aed"
  },
  "targetBaseCommit": "7e99fcbfa6aa71857866a0d10f54ca22f76d8433",
  "targetRefsBeforeImport": [
    "refs/heads/main 7e99fcbfa6aa71857866a0d10f54ca22f76d8433",
    "refs/remotes/origin/HEAD 7e99fcbfa6aa71857866a0d10f54ca22f76d8433",
    "refs/remotes/origin/main 7e99fcbfa6aa71857866a0d10f54ca22f76d8433"
  ],
  "outputBranch": "migration/history-import",
  "tools": {
    "node": "v24.19.0",
    "nodeLtsLine": "24",
    "npm": "11.17.0",
    "git": "git version 2.39.5",
    "python": "Python 3.11.2",
    "pythonExecutable": "/usr/bin/python3.11",
    "pythonExecutableSha256": "6d972cf21be56fe3c947ab6ba257ff8d08c342dd2714442986791bd9a6dfabfe",
    "uv": "uv 0.11.26 (x86_64-unknown-linux-gnu)",
    "contractSchemaBundleSha256": "86118dae2350253279d89c03b21007be3d0b9686c88a1ebb9a02457d6e6a3241",
    "gitFilterRepo": {
      "packageVersion": "2.47.0",
      "reportedVersion": "a40bce548d2c",
      "artifactPath": ".migration-work/artifacts/git_filter_repo.py",
      "artifactSha256": "67447413e273fc76809289111748870b6f6072f08b17efe94863a92d810b7d94",
      "wrapperPath": ".migration-work/bin/git-filter-repo",
      "wrapperSha256": "17403d5733cbb7594ac1f0b28caba0e8842fbfcbb28a7572a90f2a8524872945"
    },
    "contractSchemaValidator": {
      "name": "ui-router-contract-validator",
      "version": "1",
      "artifactPath": "tools/validate-migration-contract.mjs",
      "artifactSha256": "848e1fd4c096a7858d6481148d0705776237dcfeec9c9dc533aa638740df73ae"
    },
    "runtime": {
      "osImage": "uirouter-h01:2026-08-21",
      "osImageDigest": "sha256:56ab6ddaab798f0664b18448a1226bfa9e43aefaa90af280ff79d05c350a2ef8",
      "architecture": "x64",
      "timezone": "UTC",
      "locale": "C",
      "browser": null
    }
  },
  "controlFiles": [
    {
      "id": "sources",
      "source": "migration/sources.json",
      "destination": "migration/sources.json",
      "sha256": "35d5e53ca38105779af4758bc8ee22ab90ae487f8e64c294bd8eb825634c92a9"
    },
    {
      "id": "execution-lock",
      "source": "migration/execution-lock.json",
      "destination": "migration/execution-lock.json",
      "sha256": "c91e729ab343ffc652216dbcf9e4b8b3d650a6f1fecb8562dad7f419ba967aed"
    },
    {
      "id": "baselines",
      "source": "migration/baselines.json",
      "destination": "migration/baselines.json",
      "sha256": "067aba9638577ece965e0ca7527e659ff6658dd97bb57c90ec9060fe2901ccd9"
    },
    {
      "id": "package-classification",
      "source": "migration/package-classification.json",
      "destination": "migration/package-classification.json",
      "sha256": "3b96ab6740f4511c4afeb63e184f29ef4089583dedb48fbfbedde87143cdbc18"
    }
  ],
  "controlEvidence": [
    {
      "ownerContract": "baselines",
      "source": "migration/control-evidence/baselines/angular-hybrid.downstream.all.json",
      "destination": "migration/evidence/control/baselines/angular-hybrid.downstream.all.json",
      "sha256": "85941bcc5ef59557b4ce7e690d72a75d4ba7699d677b6611140ef9e9bb847d48"
    },
    {
      "ownerContract": "baselines",
      "source": "migration/control-evidence/baselines/angular-hybrid.root.build.json",
      "destination": "migration/evidence/control/baselines/angular-hybrid.root.build.json",
      "sha256": "9102c6ddbf6dfda67313a80c4d5f881a9acac4810bbb3e1901177efd69e1dafe"
    },
    {
      "ownerContract": "baselines",
      "source": "migration/control-evidence/baselines/angular-hybrid.root.install.json",
      "destination": "migration/evidence/control/baselines/angular-hybrid.root.install.json",
      "sha256": "f9f052f0c73145ec0c85fa29bc50c75cba19f66d02efe2b626663b657742c4ef"
    },
    {
      "ownerContract": "baselines",
      "source": "migration/control-evidence/baselines/angular-hybrid.root.pack.json",
      "destination": "migration/evidence/control/baselines/angular-hybrid.root.pack.json",
      "sha256": "e287d4f4df06ae4809d911ca3723c58b8899ecde59ae0cf4480a3ec02553e59d"
    },
    {
      "ownerContract": "baselines",
      "source": "migration/control-evidence/baselines/angular-hybrid.v21.build.json",
      "destination": "migration/evidence/control/baselines/angular-hybrid.v21.build.json",
      "sha256": "c11735f81a05a7c3a3d5772f7c880461f3acd6eaace60a49e12bf59a0037fb2f"
    },
    {
      "ownerContract": "baselines",
      "source": "migration/control-evidence/baselines/angular-hybrid.v21.install.json",
      "destination": "migration/evidence/control/baselines/angular-hybrid.v21.install.json",
      "sha256": "de203856c10a90cb1c600e6c86a0a54914e171ae3ac0f400c38513908d532dcf"
    },
    {
      "ownerContract": "baselines",
      "source": "migration/control-evidence/baselines/angular-hybrid.v21.pack.json",
      "destination": "migration/evidence/control/baselines/angular-hybrid.v21.pack.json",
      "sha256": "e03eee56097502a0fec586e37893a6e21de0919974af3c27f5585c4c1dd3e62c"
    },
    {
      "ownerContract": "baselines",
      "source": "migration/control-evidence/baselines/angular.downstream.all.json",
      "destination": "migration/evidence/control/baselines/angular.downstream.all.json",
      "sha256": "c1f770d8ecbd552aa547d6786663870b6d3c4de6604926453d27ca3a774e2cc8"
    },
    {
      "ownerContract": "baselines",
      "source": "migration/control-evidence/baselines/angular.root.build.json",
      "destination": "migration/evidence/control/baselines/angular.root.build.json",
      "sha256": "cbc3e3e8d75f6d1b7e783fd3c41fe25737de548cf47f3f369d76b23b58ac9f33"
    },
    {
      "ownerContract": "baselines",
      "source": "migration/control-evidence/baselines/angular.root.docs.json",
      "destination": "migration/evidence/control/baselines/angular.root.docs.json",
      "sha256": "38953398097cb10038a3cb8b77c5388dde1156c18a1d71678204e2fa93160050"
    },
    {
      "ownerContract": "baselines",
      "source": "migration/control-evidence/baselines/angular.root.install.json",
      "destination": "migration/evidence/control/baselines/angular.root.install.json",
      "sha256": "d74d2228412d0e0078e46d43528cdc16d9a77efba4ed7eba16a1cf71c5a56624"
    },
    {
      "ownerContract": "baselines",
      "source": "migration/control-evidence/baselines/angular.root.pack.json",
      "destination": "migration/evidence/control/baselines/angular.root.pack.json",
      "sha256": "16c1e0134e7e7304e695c74677063b5d4ac0c578962206cbca8418219eaa9bf8"
    },
    {
      "ownerContract": "baselines",
      "source": "migration/control-evidence/baselines/angular.root.unit.json",
      "destination": "migration/evidence/control/baselines/angular.root.unit.json",
      "sha256": "ef6516ab59ee3c2c098890f3d698af97e7e3049382f52ad585d82b39cb4cc04a"
    },
    {
      "ownerContract": "baselines",
      "source": "migration/control-evidence/baselines/angularjs.downstream.all.json",
      "destination": "migration/evidence/control/baselines/angularjs.downstream.all.json",
      "sha256": "c266989781cb6bf17ad9a748c9c74b03ded3e98eb0dc5a611d6071ddd4aad528"
    },
    {
      "ownerContract": "baselines",
      "source": "migration/control-evidence/baselines/angularjs.root.build.json",
      "destination": "migration/evidence/control/baselines/angularjs.root.build.json",
      "sha256": "e79ebc46e405e31bc24a44cce91c42ed6274ac5518eb726356ad44d501f8bc7e"
    },
    {
      "ownerContract": "baselines",
      "source": "migration/control-evidence/baselines/angularjs.root.docs.json",
      "destination": "migration/evidence/control/baselines/angularjs.root.docs.json",
      "sha256": "c49b955ce0152f418355379b86e40d57e7e812a8de7122a290022ebe3ee837a7"
    },
    {
      "ownerContract": "baselines",
      "source": "migration/control-evidence/baselines/angularjs.root.install.json",
      "destination": "migration/evidence/control/baselines/angularjs.root.install.json",
      "sha256": "cde8cf1e5a14c5c83bbedfe18bb40714e1136e3b5fa6a4b0ec887451d3b2c34f"
    },
    {
      "ownerContract": "baselines",
      "source": "migration/control-evidence/baselines/angularjs.root.pack.json",
      "destination": "migration/evidence/control/baselines/angularjs.root.pack.json",
      "sha256": "b38082693e1cf9e0f6a0b6189ebbb8aaf703486f56f69f9a7247869c8fe03ff5"
    },
    {
      "ownerContract": "baselines",
      "source": "migration/control-evidence/baselines/angularjs.root.unit.json",
      "destination": "migration/evidence/control/baselines/angularjs.root.unit.json",
      "sha256": "a966baf6a2777f760e8514dec1a72a52d75b0460a54c1c2246ba741885497c09"
    },
    {
      "ownerContract": "baselines",
      "source": "migration/control-evidence/baselines/core.downstream.all.json",
      "destination": "migration/evidence/control/baselines/core.downstream.all.json",
      "sha256": "a6fede209f3f94a14132364d554e68f133b5fbbdb9178e786bff61b3f58c38ed"
    },
    {
      "ownerContract": "baselines",
      "source": "migration/control-evidence/baselines/core.downstream.other.json",
      "destination": "migration/evidence/control/baselines/core.downstream.other.json",
      "sha256": "e44e21a4367ac8106b69b09eec79d74e7f6a3880acd921ce65c25d16ccd6af93"
    },
    {
      "ownerContract": "baselines",
      "source": "migration/control-evidence/baselines/core.root.build.json",
      "destination": "migration/evidence/control/baselines/core.root.build.json",
      "sha256": "396d3ba042ed84357ad484256d81da978564cd2e04d636bc5b31d6e825f5adac"
    },
    {
      "ownerContract": "baselines",
      "source": "migration/control-evidence/baselines/core.root.docs.json",
      "destination": "migration/evidence/control/baselines/core.root.docs.json",
      "sha256": "66b6bf387f39b2d7bb58c33a993e4dfbb805e784bef55c57440f6abba78968f3"
    },
    {